<?xml version="1.0"?>

<!--

file: FallingDrop.xml everything for Sheet4, has to be made!
author: F.Dietz & L.Spiegelberg

-->

<simulationfile xmlns:xsi="http://www.w3.org/2001/XMLSchema-instance"
       xsi:noNamespaceSchemaLocation="simulationfile.xsd">

  <params>
    <dimension>2</dimension>
    <initialTemperature>40</initialTemperature>
    <iterationsTillThermostatApplication>1000</iterationsTillThermostatApplication>
    <targetTemperature>0.5</targetTemperature>
    <temperatureStepSize>0.2</temperatureStepSize>
    <gravity>-12.44</gravity>
    <output>TXT</output>
    <outputfmt>TXT</outputfmt>
    <iterationsperoutput>1000</iterationsperoutput>
   
    <delta_t>0.0005</delta_t>
    <epsilon>1.0</epsilon>
   
    <sigma>1.2</sigma>
    
    <t_end>15.1</t_end>
    <t_start>0.0</t_start>
    
    <algorithm>
      <LinkedCell>
        <cutoff_radius>2.5</cutoff_radius>
        <sizeofdomainX>303.0</sizeofdomainX>
        <sizeofdomainY>180.0</sizeofdomainY>
        <sizeofdomainZ>0.0</sizeofdomainZ>
        <offset>0.0 0.0 0.0</offset>
        <conditions>
          <condition value="all"></condition>
        </conditions>
      </LinkedCell>
    </algorithm>
    
  </params>

  <data>
    <!-- material1-->
    <material epsilon="1.0" sigma="1.2" name="bassinMat" mass="1.0"/>
   
    <!-- C1 -->
    <cuboid>
      <h>1.1225</h>
      <N>250 50 1</N>
      <V>0.0 0.0 0.0</V>
      <X>1.5 2.0 0.0</X>
      <material>bassinMat</material>
    </cuboid>
    
  </data>

</simulationfile>
