<?xml version="1.0"?>

<!--

file: used to create an equilibrated fluid
author: F.Dietz & L.Spiegelberg

-->

<simulationfile xmlns:xsi="http://www.w3.org/2001/XMLSchema-instance"
       xsi:noNamespaceSchemaLocation="simulationfile.xsd">

  <params>
    <dimension>3</dimension>
    <output>argoneqnew</output>
    
    <iterationsperoutput>1000</iterationsperoutput>
    <initialTemperature>0.01</initialTemperature>
    <iterationsTillThermostatApplication>40</iterationsTillThermostatApplication>
    <targetTemperature>3.0</targetTemperature>
    <temperatureStepSize>0.001</temperatureStepSize>
   
    <delta_t>0.001</delta_t>
    <epsilon>1.0</epsilon>
    <outputfmt>TXT</outputfmt>
    <sigma>1.0</sigma>
    
    <t_end>150.0</t_end>
    <t_start>0.0</t_start>
    <potentialforce>
      <SLJ></SLJ>
    </potentialforce>
    <!--<thermodynamicaldata iterationsTillCalculation="100" iterationsPerCalculation="4" deltat="0.2"></thermodynamicaldata>
   -->
    <algorithm>
      <LinkedCell>
        <cutoff_radius>2.3</cutoff_radius>
        <sizeofdomainX>9.2</sizeofdomainX>
        <sizeofdomainY>9.2</sizeofdomainY>
        <sizeofdomainZ>9.2</sizeofdomainZ>
        <offset>0.0 0.0 0.0</offset>
        <conditions>
          <condition value="front" type="periodic"></condition>
          <condition value="back" type="periodic"></condition>
          <condition value="left" type="periodic"></condition>
          <condition value="right" type="periodic"></condition>
          <condition value="top" type="periodic"></condition>
          <condition value="bottom" type="periodic"></condition>
        </conditions>
      </LinkedCell>
    </algorithm>
    
  </params>

  <data>
    <!-- material1-->
    <material epsilon="1.0" sigma="1.0" name="Liquid1" mass="1.0"/>
    
    <!-- C1 -->
    <cuboid>
      <h>1.15</h>
      <N>8 8 8</N>
      <V>0.0 0.0 0.0</V>
      <X>0.575 0.575 0.575</X>
      <material>Liquid1</material>
    </cuboid>
    
  </data>

</simulationfile>
