<?xml version="1.0"?>

<!--

file: used to perform cooling experiment
author: F.Dietz & L.Spiegelberg

-->

<simulationfile xmlns:xsi="http://www.w3.org/2001/XMLSchema-instance"
       xsi:noNamespaceSchemaLocation="simulationfile.xsd">

  <params>
    <dimension>3</dimension>
    <output>argoncooling</output>
    
    <iterationsperoutput>100</iterationsperoutput>
    <initialTemperature>3.0</initialTemperature>
    <iterationsTillThermostatApplication>50</iterationsTillThermostatApplication>
    <targetTemperature>0.5</targetTemperature>
    <temperatureStepSize>-0.00078</temperatureStepSize>
   
    <delta_t>0.001</delta_t>
    <epsilon>1.0</epsilon>
    <outputfmt>VTK</outputfmt>
    <sigma>1.0</sigma>
    
    <t_end>250.0</t_end>
    <t_start>0.0</t_start>
    <potentialforce>
      <SLJ></SLJ>
    </potentialforce>
    <thermodynamicaldata iterationsTillCalculation="1000" iterationsPerCalculation="5" deltat="0.2"></thermodynamicaldata>
   
    <algorithm>
      <LinkedCell>
        <cutoff_radius>2.3</cutoff_radius>
        <sizeofdomainX>9.2</sizeofdomainX>
        <sizeofdomainY>9.2</sizeofdomainY>
        <sizeofdomainZ>9.2</sizeofdomainZ>
        <offset>0.0 0.0 0.0</offset>
        <conditions>
          <condition value="front" type="reflective"></condition>
          <condition value="back" type="reflective"></condition>
          <condition value="left" type="periodic"></condition>
          <condition value="right" type="periodic"></condition>
          <condition value="top" type="periodic"></condition>
          <condition value="bottom" type="periodic"></condition>
        </conditions>
      </LinkedCell>
    </algorithm>
    
  </params>

  <data>
    <!-- material1-->
    <material epsilon="1.0" sigma="1.0" name="Liquid1" mass="1.0"/>
    
    <!-- use txt inputfile -->
    <inputfile>argoneq.txt</inputfile>
    
  </data>

</simulationfile>
