<?xml version="1.0"?>

<!--

file: example.xml shows usage of the XML Format
author: F.Dietz & L.Spiegelberg

-->

<simulationfile xmlns:xsi="http://www.w3.org/2001/XMLSchema-instance"
       xsi:noNamespaceSchemaLocation="simulationfile.xsd">

  <params>
    <output>out</output>
    
    <iterationsperoutput>10</iterationsperoutput>
    <brownianMotionFactor>0.1</brownianMotionFactor>
   
    <delta_t>0.02</delta_t>
    <epsilon>5.0</epsilon>
    <outputfmt>VTK</outputfmt>
    <sigma>1.0</sigma>
    
    <t_end>5.0</t_end>
    <t_start>0.0</t_start>
    
    <algorithm>
      <LinkedCell>
        <cutoff_radius>3.0</cutoff_radius>
        <sizeofdomainX>180.0</sizeofdomainX>
        <sizeofdomainY>90.0</sizeofdomainY>
        <sizeofdomainZ>0.0</sizeofdomainZ>
      </LinkedCell>
    </algorithm>
    
  </params>

  <data>
    <inputfile>cuboid.txt</inputfile>
  </data>

</simulationfile>
