<?xml version="1.0"?>

<!--

file: example.xml shows usage of the XML Format
author: F.Dietz & L.Spiegelberg

-->

<simulationfile xmlns:xsi="http://www.w3.org/2001/XMLSchema-instance"
       xsi:noNamespaceSchemaLocation="simulationfile.xsd">

  <params>
    <output>out</output>
    
    <iterationsperoutput>10</iterationsperoutput>
    <timestepsPerThermostatApplication>-1</timestepsPerThermostatApplication>
    <initialTemperature>0.0</initialTemperature>
    <targetTemperature>2.0</targetTemperature>
    <temperatureDifferenceStepSize>0.1</temperatureDifferenceStepSize>
   
    <delta_t>0.00005</delta_t>
    <epsilon>5.0</epsilon>
    <outputfmt>VTK</outputfmt>
    <sigma>1.0</sigma>
    
    <t_end>5.0</t_end>
    <t_start>0.0</t_start>
    
    <algorithm>
      <List></List>
    </algorithm>
    
  </params>

  <data>
    <sphere>
      <dimensions>2</dimensions>
      <h>1.1225</h>
      <m>1.0</m>
      <r>15</r>
      <V>0.0 -10.0 0.0</V>
      <X>60.0 25.0 0.0</X>
    </sphere>
  </data>

</simulationfile>
